{
    "acmSettings": {
        "rho0": 1.0,
        "beta2": 1.0,
        "alpha": 0.0,
        "dynamicViscosity": 0.0,
        "riemannSolverType": "Roe",
        "pressureStorage": "PhysicalP",
        "entropyFixRatio": 0.05,
        "pressureReference": 0.0,
        "farFieldValue": [1.0, 0.0, 0.0, 0.0],
        "enableViscousFlux": false
    },
    "timeMarchSettings": {
        "integrator": "ExplicitSSPRK3",
        "nSteps": 0,
        "pseudoTimeStep": 0.01,
        "maxImplicitIterations": 20,
        "implicitTolerance": 1e-10,
        "implicitRelaxation": 1.0
    },
    "leftState": [1.0, 0.0, 0.0, 0.0],
    "rightState": [0.0, 0.0, 0.0, 0.0],
    "unitNormal": [1.0, 0.0, 0.0],
    "nFacesPerRank": 16
}
